packet_board_id,review_order,board_words,solution_groups,unique_clear_grouping,fair_not_forced,labels_feel_natural,aha_satisfaction,publishable,notes
blind_board_001,1,DAYS | DONUT | PADDLE | RHYTHM | REGISTER | CATCH | TIME | CLOCK | METER | INCH | NOTICE | JUROR | MONTH | TIRED | BEAT | TAG,"CADENCE: RHYTHM, BEAT, TIME, METER || ONE IN A GROUP OF TWELVE: MONTH, JUROR, DONUT, INCH || PERCEIVE: NOTICE, CLOCK, REGISTER, CATCH || DOG ___: TAG, TIRED, DAYS, PADDLE",,,,,,
blind_board_002,2,YIELD | GROSS | SLOW | MUTE | CALM | OIL | SNARE | SLEEPY | MAKE | STOP | QUIET | HOME | NET | EAR | VOLUME | KETTLE,"WORDS BEFORE “DRUM”: SNARE, KETTLE, EAR, OIL || EARN: YIELD, GROSS, MAKE, NET || HARDLY BUSTLING: CALM, QUIET, SLOW, SLEEPY || REMOTE CONTROL FUNCTIONS: VOLUME, STOP, HOME, MUTE",,,,,,
blind_board_003,3,CONTROL | CHEESE | PROGRESSIVE | OPTION | SPILL | PAN | TELL | SHORT | CUP | DISH | RETURN | EMOTIONAL | COMMAND | POPULAR | BLAB | ALTERNATIVE,"___CAKE: CUP, CHEESE, PAN, SHORT || DIVULGE: SPILL, DISH, BLAB, TELL || WORDS ON A MAC KEYBOARD: OPTION, CONTROL, RETURN, COMMAND || WORDS SHORTENED IN ROCK GENRES: ALTERNATIVE, PROGRESSIVE, POPULAR, EMOTIONAL",,,,,,
blind_board_004,4,MILK | PICKLE | FREEZE | SYRUP | BEANS | GRATE | GUTS | GNASH | HOT SAUCE | JAM | FERMENT | GRIND | TEA | CAN | SCRAPE | BUTTER,"BREAKFAST CONDIMENTS: BUTTER, SYRUP, JAM, HOT SAUCE || WAYS TO PRESERVE FOOD: PICKLE, FERMENT, FREEZE, CAN || RUB TOGETHER: GRIND, SCRAPE, GNASH, GRATE || PROVERBIAL THINGS THAT ARE SPILLED: TEA, GUTS, BEANS, MILK",,,,,,
blind_board_005,5,MICHELANGELO | CASH | MERCURY | LEONARDO | VENUS | DONATELLO | EARTH | HEEL | MARS | RAPHAEL | MASH | KEEL | PEEL | REEL | BASH | DASH,"Teenage Mutant Ninja Turtles: MICHELANGELO, LEONARDO, DONATELLO, RAPHAEL || Ends with -ASH: DASH, CASH, MASH, BASH || Planets: MARS, EARTH, VENUS, MERCURY || Rhymes with -EEL: KEEL, PEEL, HEEL, REEL",,,,,,
blind_board_006,6,MARS | CASH | SNOW | SNAP | TOPAZ | OPAL | JADE | MASH | SNUG | VENUS | EARTH | MERCURY | DASH | BASH | SNIP | RUBY,"Rhymes with -ASH: BASH, CASH, DASH, MASH || Planets: MERCURY, EARTH, MARS, VENUS || Starts with SN: SNAP, SNUG, SNIP, SNOW || Gemstones: JADE, OPAL, RUBY, TOPAZ",,,,,,
blind_board_007,7,MICHELANGELO | RAPHAEL | LEONARDO | CAKE | CASH | MASH | MERCURY | EARTH | BASH | VENUS | LAKE | RAKE | MARS | DONATELLO | DASH | BAKE,"Planets: MARS, EARTH, VENUS, MERCURY || Rhymes with -ASH: BASH, CASH, DASH, MASH || Ends with -AKE: BAKE, CAKE, RAKE, LAKE || Teenage Mutant Ninja Turtles: MICHELANGELO, LEONARDO, DONATELLO, RAPHAEL",,,,,,
blind_board_008,8,MULTI | SHOEBOX | BRICK | MUCHO | PICKLE | LIME | MOLTO | RELISH | ZEST | BEAUCOUP | MORTAR | GUSTO | MICROWAVE | JENNY | PASSION | FISH TANK,"RECTANGULAR PRISMS: BRICK, SHOEBOX, MICROWAVE, FISH TANK || RHYME WITH U.S. COINS: LIME, JENNY, MORTAR, PICKLE || “MANY” IN DIFFERENT LANGUAGES: MUCHO, MULTI, BEAUCOUP, MOLTO || ENTHUSIASM: PASSION, RELISH, GUSTO, ZEST",,,,,,
blind_board_009,9,BROOD | LITTER | CABBAGE | SOUL | WORK | ROUGH | REFLECT | PONDER | CRAFT | POINT | NICOTINE | INTERRUPT | STARE | MUSE | TRADE | LINE,"CONTEMPLATE: REFLECT, PONDER, MUSE, BROOD || RUDE THINGS TO DO: STARE, LITTER, INTERRUPT, POINT || VOCATION: WORK, CRAFT, TRADE, LINE || ___ PATCH: CABBAGE, SOUL, ROUGH, NICOTINE",,,,,,
blind_board_010,10,JADE | MASH | SNIP | MICHELANGELO | CASH | SNUG | BASH | LEONARDO | DONATELLO | TOPAZ | DASH | SNAP | RAPHAEL | OPAL | RUBY | SNOW,"Teenage Mutant Ninja Turtles: MICHELANGELO, LEONARDO, DONATELLO, RAPHAEL || Rhymes with -ASH: BASH, CASH, DASH, MASH || Gemstones: JADE, OPAL, RUBY, TOPAZ || Starts with SN: SNAP, SNUG, SNIP, SNOW",,,,,,
blind_board_011,11,RUBY | SNOW | SNAP | SNIP | PEEL | EARTH | SNUG | VENUS | JADE | MERCURY | HEEL | TOPAZ | KEEL | MARS | OPAL | REEL,"Gemstones: JADE, OPAL, RUBY, TOPAZ || Rhymes with -EEL: KEEL, PEEL, HEEL, REEL || Planets: MERCURY, EARTH, MARS, VENUS || Starts with SN: SNAP, SNUG, SNIP, SNOW",,,,,,
blind_board_012,12,KEEP | STICKY | SAND | CHICKEN | FILE | SAVE | FAVORITE | BUTTER | STORE | PRESERVE | UNDER | SPREAD | GRIND | PARLAY | BUFF | LADY,"SPORTS GAMBLING TERMS: PARLAY, SPREAD, UNDER, FAVORITE || SMOOTH USING FRICTION: GRIND, SAND, BUFF, FILE || CONSERVE: PRESERVE, SAVE, STORE, KEEP || WORDS BEFORE “FINGERS”: BUTTER, CHICKEN, STICKY, LADY",,,,,,
blind_board_013,13,OPAL | RAKE | JADE | MERCURY | RUBY | MARS | CAKE | HEEL | REEL | VENUS | PEEL | EARTH | KEEL | TOPAZ | LAKE | BAKE,"Gemstones: JADE, OPAL, RUBY, TOPAZ || Ends with -AKE: BAKE, CAKE, RAKE, LAKE || Rhymes with -EEL: KEEL, PEEL, HEEL, REEL || Planets: MERCURY, EARTH, MARS, VENUS",,,,,,
blind_board_014,14,PEEL | HEEL | BLINKY | INKY | TOPAZ | REEL | PINKY | BAKE | OPAL | RUBY | CAKE | RAKE | CLYDE | KEEL | JADE | LAKE,"Ends with -AKE: BAKE, CAKE, RAKE, LAKE || Gemstones: JADE, OPAL, RUBY, TOPAZ || Rhymes with -EEL: KEEL, PEEL, HEEL, REEL || Pac-Man ghosts: PINKY, INKY, CLYDE, BLINKY",,,,,,
blind_board_015,15,AIR | STREAM | BAY | STIR | TREE | BARK | SNARL | HOWL | GARNISH | CHAIN | PYRAMID | MUDDLE | STRAIN | LADDER | RUN | PLAY,"SOUND LIKE A DOG: BAY, HOWL, BARK, SNARL || ORGANIZATIONAL STRUCTURES, METAPHORICALLY: TREE, CHAIN, PYRAMID, LADDER || BROADCAST, AS ONLINE MEDIA: RUN, AIR, STREAM, PLAY || COCKTAIL-MAKING VERBS: STIR, STRAIN, MUDDLE, GARNISH",,,,,,
blind_board_016,16,STAR | SPONGE | POLO | OXFORD | ZIT | BUBBLE | CORAL | FETT | PENN | PEARL | TEE | BOBA | FLANNEL | TORTE | TAPIOCA | JELLY,"MARINE INVERTEBRATES, FAMILIARLY: SPONGE, STAR, JELLY, CORAL || STARTS OF PASTA NAMES: TORTE, FETT, ZIT, PENN || KINDS OF SHIRTS: POLO, OXFORD, FLANNEL, TEE || SPHERES IN MILK TEA: BUBBLE, TAPIOCA, BOBA, PEARL",,,,,,
blind_board_017,17,WRENCH | MAD | NIGHT | STRAP | BUD | YANK | HUB | MAN | BLOCK | JACK | BUB | TUG | KNEE | BOLSTER | JERK | MAT,"BUSTER: BUD, JACK, BUB, MAN || WREST: WRENCH, TUG, JERK, YANK || ___CAP: NIGHT, HUB, KNEE, MAD || YOGA ACCESSORIES: STRAP, MAT, BOLSTER, BLOCK",,,,,,
blind_board_018,18,MARS | CLYDE | TOPAZ | REEL | HEEL | PINKY | BLINKY | MERCURY | VENUS | KEEL | OPAL | PEEL | INKY | JADE | RUBY | EARTH,"Gemstones: JADE, OPAL, RUBY, TOPAZ || Planets: MARS, EARTH, VENUS, MERCURY || Pac-Man ghosts: PINKY, INKY, CLYDE, BLINKY || Rhymes with -EEL: KEEL, PEEL, HEEL, REEL",,,,,,
blind_board_019,19,FRIDGE | COUNCIL | DROP | MOUNTAIN CLIMBER | BOAT | PANEL | RANGE | CABINET | CHANDELIER | PLANK | COUNTER | BOARD | CRUNCH | SINK | STUD | HOOP,"CORE EXERCISES: PLANK, MOUNTAIN CLIMBER, BOAT, CRUNCH || KINDS OF EARRINGS: STUD, DROP, HOOP, CHANDELIER || GROUP OF ADVISORS: BOARD, COUNCIL, PANEL, CABINET || SEEN IN A KITCHEN: FRIDGE, SINK, RANGE, COUNTER",,,,,,
blind_board_020,20,SHRED | SIGNATURE | SYRUP | POWDER | TOTAL | EMPTY | GRAIN | EXHAUST | CUBE | TIP | ROCK | GROOVE | DRAIN | JAM | TAX | SAP,"DEPLETE: DRAIN, EXHAUST, SAP, EMPTY || WORDS ON A RESTAURANT RECEIPT: TAX, TIP, TOTAL, SIGNATURE || FORMS OF SUGAR: POWDER, SYRUP, CUBE, GRAIN || PLAY MUSIC WITH PASSION: JAM, GROOVE, SHRED, ROCK",,,,,,
blind_board_021,21,INKY | TOPAZ | CAKE | BASH | OPAL | JADE | RUBY | CLYDE | PINKY | CASH | RAKE | LAKE | BLINKY | BAKE | MASH | DASH,"Ends with -AKE: BAKE, CAKE, RAKE, LAKE || Rhymes with -ASH: BASH, CASH, DASH, MASH || Gemstones: JADE, OPAL, RUBY, TOPAZ || Pac-Man ghosts: PINKY, INKY, CLYDE, BLINKY",,,,,,
blind_board_022,22,LAKE | DONATELLO | MICHELANGELO | RAKE | TOPAZ | CASH | CAKE | RAPHAEL | JADE | LEONARDO | OPAL | DASH | BAKE | MASH | BASH | RUBY,"Gemstones: JADE, OPAL, RUBY, TOPAZ || Ends with -AKE: BAKE, CAKE, RAKE, LAKE || Rhymes with -ASH: BASH, CASH, DASH, MASH || Teenage Mutant Ninja Turtles: MICHELANGELO, LEONARDO, DONATELLO, RAPHAEL",,,,,,
blind_board_023,23,PEEL | OPAL | TOPAZ | BLINKY | SNUG | INKY | SNOW | SNIP | JADE | HEEL | REEL | KEEL | PINKY | CLYDE | SNAP | RUBY,"Pac-Man ghosts: PINKY, INKY, CLYDE, BLINKY || Rhymes with -EEL: KEEL, PEEL, HEEL, REEL || Starts with SN: SNAP, SNUG, SNIP, SNOW || Gemstones: JADE, OPAL, RUBY, TOPAZ",,,,,,
blind_board_024,24,TICK | CLOCK | ANT | CROSS | STRIKE | CRUMPLE | CLIP | SCRUNCH | CHECK | BUCKLE | BRANCH | MELTING | WAD | BALL | SNAP | HOOK,"FASTENERS: CLIP, BUCKLE, SNAP, HOOK || DEPICTED IN DALÍ’S “THE PERSISTENCE OF MEMORY”: BRANCH, ANT, MELTING, CLOCK || CRUSH INTO A COMPACT SHAPE: BALL, WAD, CRUMPLE, SCRUNCH || MARK AS COMPLETED: CHECK, TICK, CROSS, STRIKE",,,,,,
blind_board_025,25,MASH | CASH | DASH | BASH | JADE | BAKE | MARS | MERCURY | CAKE | LAKE | RAKE | RUBY | TOPAZ | EARTH | OPAL | VENUS,"Planets: MERCURY, EARTH, MARS, VENUS || Ends with -AKE: BAKE, CAKE, RAKE, LAKE || Rhymes with -ASH: BASH, CASH, DASH, MASH || Gemstones: JADE, OPAL, RUBY, TOPAZ",,,,,,
blind_board_026,26,CASH | MARS | HEEL | KEEL | OPAL | VENUS | MASH | PEEL | TOPAZ | JADE | REEL | RUBY | EARTH | DASH | BASH | MERCURY,"Gemstones: JADE, OPAL, RUBY, TOPAZ || Planets: MERCURY, EARTH, MARS, VENUS || Ends with -ASH: DASH, CASH, MASH, BASH || Rhymes with -EEL: KEEL, PEEL, HEEL, REEL",,,,,,
blind_board_027,27,KEEL | SNOW | VENUS | RAPHAEL | LEONARDO | MICHELANGELO | DONATELLO | HEEL | PEEL | SNUG | SNIP | REEL | MERCURY | EARTH | MARS | SNAP,"Teenage Mutant Ninja Turtles: MICHELANGELO, LEONARDO, DONATELLO, RAPHAEL || Rhymes with -EEL: KEEL, PEEL, HEEL, REEL || Planets: MARS, EARTH, VENUS, MERCURY || Starts with SN: SNAP, SNUG, SNIP, SNOW",,,,,,
blind_board_028,28,LAMP | EARRING | BLUE | BULL | RUN | HEAD | TIRE | ERASER | VELVET | GALOSH | DIRECT | LEAD | CROSS | BALLOON | WISHES | HERRING,"RED ___: HERRING, BULL, VELVET, CROSS || ASSOCIATED WITH THE GENIE IN “ALADDIN”: LAMP, EARRING, WISHES, BLUE || THINGS MADE OF RUBBER: GALOSH, TIRE, ERASER, BALLOON || BE IN CHARGE OF: HEAD, RUN, DIRECT, LEAD",,,,,,
blind_board_029,29,EARTH | PINKY | CLYDE | KEEL | BLINKY | MERCURY | MARS | INKY | SNOW | REEL | SNAP | HEEL | VENUS | SNUG | SNIP | PEEL,"Rhymes with -EEL: KEEL, PEEL, HEEL, REEL || Planets: MARS, EARTH, VENUS, MERCURY || Starts with SN: SNAP, SNUG, SNIP, SNOW || Pac-Man ghosts: PINKY, INKY, CLYDE, BLINKY",,,,,,
blind_board_030,30,RELATE | FELLOW | EQUATE | BOW | AFFILIATE | CHUM | LEGS | LIBERTY | WINGS | BAIT | STORM | ASSOCIATE | SUN | LURE | FLY | HORN,"THINK OF TOGETHER: AFFILIATE, RELATE, EQUATE, ASSOCIATE || W.N.B.A. TEAMS: LIBERTY, SUN, WINGS, STORM || LONG___: BOW, FELLOW, HORN, LEGS || WAYS TO ATTRACT FISH: CHUM, LURE, BAIT, FLY",,,,,,
blind_board_031,31,CLOVE | GRUMBLE | STALK | SPEAR | CARP | BELLYACHE | BLINDFOLD | RESOLUTION | ROBE | RAM | CRAB | STORAGE | SCALES | SWORD | FLORET | SPEED,"LAPTOP SPECS: STORAGE, SPEED, RESOLUTION, RAM || VEGETABLE UNITS: FLORET, SPEAR, CLOVE, STALK || COMPLAIN: GRUMBLE, CRAB, CARP, BELLYACHE || FEATURES OF JUSTICE PERSONIFIED: BLINDFOLD, ROBE, SCALES, SWORD",,,,,,
blind_board_032,32,MICHELANGELO | MARS | MERCURY | SNOW | CASH | VENUS | DASH | SNUG | LEONARDO | SNAP | EARTH | BASH | RAPHAEL | MASH | DONATELLO | SNIP,"Planets: MARS, EARTH, VENUS, MERCURY || Teenage Mutant Ninja Turtles: MICHELANGELO, LEONARDO, DONATELLO, RAPHAEL || Starts with SN: SNAP, SNUG, SNIP, SNOW || Rhymes with -ASH: BASH, CASH, DASH, MASH",,,,,,
blind_board_033,33,BARB | MINIATURE | FIGURE | SHOVEL | DIG | OCTOPUS | SAND | SLIGHT | PEPPER | MODEL | SALT | DOLL | CRACK | WHO | NO | PLOW,"USED TO CLEAR SNOW: SAND, SHOVEL, PLOW, SALT || SMALL LIKENESS: MINIATURE, FIGURE, MODEL, DOLL || PUTDOWN: DIG, SLIGHT, CRACK, BARB || DOCTORS IN POP CULTURE: NO, PEPPER, WHO, OCTOPUS",,,,,,
blind_board_034,34,FISH | CLOISTER | SEPARATE | PROMO | HUNT | SILO | TRACTOR | GATHER | RAVEN | FARM | DISCOG | BALLY | AXLES | HITCH | SECLUDE | TRAILER,"WAYS TO GET FOOD: GATHER, FISH, FARM, HUNT || KEEP APART: SILO, SEPARATE, CLOISTER, SECLUDE || PARTS OF A BIG RIG: HITCH, TRAILER, AXLES, TRACTOR || DANCE EVENTS PLUS A LETTER: DISCOG, RAVEN, BALLY, PROMO",,,,,,
blind_board_035,35,DASH | BASH | SNAP | JADE | OPAL | MASH | TOPAZ | CLYDE | CASH | RUBY | INKY | SNUG | BLINKY | SNOW | PINKY | SNIP,"Rhymes with -ASH: BASH, CASH, DASH, MASH || Pac-Man ghosts: PINKY, INKY, CLYDE, BLINKY || Gemstones: JADE, OPAL, RUBY, TOPAZ || Starts with SN: SNAP, SNUG, SNIP, SNOW",,,,,,
blind_board_036,36,BAR | LIGHT BULB | KNOCK-KNOCK | CHICKEN | PILLOW | YODEL | SNOWBALL | DEVIL DOG | AM | HAM | SATELLITE | WALKIE-TALKIE | WATER BALLOON | HOHO | DING DONG | FOOD,"CLASSIC JOKE STAPLES: KNOCK-KNOCK, CHICKEN, BAR, LIGHT BULB || SNACK CAKES: HOHO, YODEL, DING DONG, DEVIL DOG || KINDS OF PLAY FIGHTS: SNOWBALL, WATER BALLOON, FOOD, PILLOW || TYPES OF RADIO: WALKIE-TALKIE, HAM, SATELLITE, AM",,,,,,
blind_board_037,37,BAKE | RAKE | EARTH | MICHELANGELO | VENUS | SNOW | MERCURY | LAKE | CAKE | SNAP | MARS | SNIP | RAPHAEL | SNUG | LEONARDO | DONATELLO,"Rhymes with -AKE: RAKE, LAKE, BAKE, CAKE || Planets: MARS, EARTH, VENUS, MERCURY || Starts with SN: SNAP, SNUG, SNIP, SNOW || Teenage Mutant Ninja Turtles: MICHELANGELO, LEONARDO, DONATELLO, RAPHAEL",,,,,,
blind_board_038,38,EARTH | LAKE | BLINKY | INKY | PINKY | RAKE | BAKE | MERCURY | SNUG | CLYDE | VENUS | SNOW | SNIP | SNAP | MARS | CAKE,"Starts with SN: SNAP, SNUG, SNIP, SNOW || Pac-Man ghosts: PINKY, INKY, CLYDE, BLINKY || Planets: MARS, EARTH, VENUS, MERCURY || Rhymes with -AKE: RAKE, LAKE, BAKE, CAKE",,,,,,
blind_board_039,39,SNUG | BLINKY | CASH | MARS | MERCURY | SNOW | BASH | CLYDE | SNIP | PINKY | INKY | MASH | VENUS | DASH | SNAP | EARTH,"Starts with SN: SNAP, SNUG, SNIP, SNOW || Rhymes with -ASH: BASH, CASH, DASH, MASH || Planets: MARS, EARTH, VENUS, MERCURY || Pac-Man ghosts: PINKY, INKY, CLYDE, BLINKY",,,,,,
blind_board_040,40,SIGN | INSURANCE | INVOICE | VACATION | BANKNOTE | SALARY | CUT | GIVEAWAY | BEAK | TELL | WILLIAM | BONUS | DEAL | FAN | FLAG | SHUFFLE,"WHAT “BILL” MIGHT REFER TO: BEAK, BANKNOTE, INVOICE, WILLIAM || THINGS TO DO WITH A DECK OF CARDS: CUT, SHUFFLE, DEAL, FAN || PARTS OF A COMPENSATION PACKAGE: INSURANCE, VACATION, SALARY, BONUS || INDICATION: TELL, SIGN, FLAG, GIVEAWAY",,,,,,
